{"skill_invocation":"$observable-receipt-distiller","candidate_skill_dir":".agents/skills/frontmatter-repair","distill_exit_code":0,"evaluation_exit_code":0,"holdout_result":"4/4","source_receipts_unchanged":true,"changed_files":[".agents/skills/frontmatter-repair/SKILL.md",".agents/skills/frontmatter-repair/references/frontmatter-contract.md",".agents/skills/frontmatter-repair/scripts/repair-frontmatter.mjs","reports/distillation-summary.json","reports/evaluation-summary.json","reports/evaluation-summary.test.json"],"tests_command":"npm test","tests_status":"passed","notes":"Candidate generated from receipts/training. Holdout evaluation passed 4/4 with 0 failures. npm test passed. Receipt SHA-256 checksums matched before and after."}
